{
 "schema": "full-depth-sweep/2",
 "origin": "REAL_OBSERVATION_PIPELINE",
 "runId": "SEAT_DEPTH_SWEEP_002",
 "producerStatus": "FRESH_DEPTH_SWEEP_AND_DEV_VERIFIED_NOT_ADOPTED",
 "priorAttempt": {
  "runId": "SEAT_DEPTH_SWEEP_001",
  "outcome": "STOPPED_BEFORE_TRAINING",
  "freshFits": 0,
  "accepted": false,
  "publicScorePublished": false
 },
 "receiptSha256": "82f41170bb99232a252450a10d6591d6b2a0fbd14438f8d3acfaec1dba7c85e1",
 "completeSha256": "74ee1af789452a4bc16c9f2610109085a4469acc5fc1ebb0652b9b6b421810bc",
 "phase": "COMPLETE",
 "terminal": true,
 "statusDetail": "실제 전체 TRAIN 38,651,044행으로 fresh depth 4·6·8을 각 256 rounds 학습하고 전체 DEV 20,989,927행으로 한 번 평가했다. DEV는 이전 실행에서도 쓴 자료라 채택·일반화 근거가 아니다.",
 "candidate": null,
 "trainingCallsReserved": 3,
 "verifiedCandidateCount": 3,
 "currentModelRoundsCompleted": null,
 "trainRows": 38651044,
 "devRows": 20989927,
 "baselineRounds": 256,
 "models": [
  {
   "id": "BASELINE",
   "targetRounds": 256,
   "observedRounds": 256,
   "status": "VALIDATED_SAVED_REFERENCE",
   "metrics": {
    "MAE": 4.457313790999137,
    "MSE": 51.61923031403158,
    "RMSE": 7.184652414280846,
    "Brier": null,
    "logLoss": null,
    "NRPS": null
   },
   "gatePassed": null,
   "depth": 6,
   "trainingMode": "CONTINUED_REFERENCE"
  },
  {
   "id": "D4",
   "targetRounds": 256,
   "observedRounds": 256,
   "status": "VERIFIED",
   "metrics": {
    "MAE": 4.477016485836823,
    "MSE": 51.89817678377675,
    "RMSE": 7.2040389215895235,
    "Brier": null,
    "logLoss": null,
    "NRPS": null
   },
   "gatePassed": false,
   "depth": 4,
   "trainingMode": "FRESH_FROM_ZERO"
  },
  {
   "id": "D6",
   "targetRounds": 256,
   "observedRounds": 256,
   "status": "VERIFIED",
   "metrics": {
    "MAE": 4.457074923913521,
    "MSE": 51.60426089029891,
    "RMSE": 7.183610574794468,
    "Brier": null,
    "logLoss": null,
    "NRPS": null
   },
   "gatePassed": true,
   "depth": 6,
   "trainingMode": "FRESH_FROM_ZERO"
  },
  {
   "id": "D8",
   "targetRounds": 256,
   "observedRounds": 256,
   "status": "VERIFIED",
   "metrics": {
    "MAE": 4.459098339652402,
    "MSE": 51.841217556320906,
    "RMSE": 7.200084552025824,
    "Brier": null,
    "logLoss": null,
    "NRPS": null
   },
   "gatePassed": false,
   "depth": 8,
   "trainingMode": "FRESH_FROM_ZERO"
  }
 ],
 "bestObservedDevModel": "D6",
 "workerElapsedSeconds": 426.29912636900553,
 "servedAt": "2026-10-21T08:56:12.667394Z",
 "sourceReportedAt": "2026-10-21T08:35:59.379049Z",
 "legacyRunAccepted": false,
 "modelAdoption": false,
 "generalizationClaim": false,
 "DEVReused": true,
 "productComparison": "NOT_CONNECTED",
 "freshRoundsCompleted": 768,
 "devRowsProcessed": 20989927,
 "pureDepthContrast": "FRESH_D4_D6_D8_ONLY",
 "continuedBaselineIsNotFreshControl": true
}
